{
  "package_id": "model_review_round1-reviewer_b",
  "run_metadata": {
    "mode_as_displayed": "not_available",
    "model_name_as_displayed": "not_available",
    "run_date_utc": "2026-09-22",
    "tools_used": [],
    "unavailable_settings": [
      "mode_as_displayed",
      "model_name_as_displayed"
    ]
  },
  "decisions": [
    {
      "ambiguity": false,
      "decision": "ALLOW",
      "notes": "Valid action by authorized principal, within parameter bounds, approved.",
      "rationale": "All rules pass. Action is correctly targeted and approved.",
      "review_id": "review-6a695a49130665a639d45e40fc6c86c5",
      "rule_refs": []
    },
    {
      "ambiguity": false,
      "decision": "DENY",
      "notes": "Policy weight exceeds maximum allowed.",
      "rationale": "Parameter policy_weight is 1.5, which exceeds the maximum value of 1.0.",
      "review_id": "review-1b158d6efd2768dc5a63248aa02553ee",
      "rule_refs": [
        "parameter_bounds.modify_a1_policy.policy_weight"
      ]
    },
    {
      "ambiguity": false,
      "decision": "ALLOW",
      "notes": "Valid approved isolation on best-effort slice.",
      "rationale": "All rules pass. Authorized and approved.",
      "review_id": "review-4ac98afb1acf6bcc3be3d3013eaff489",
      "rule_refs": []
    },
    {
      "ambiguity": false,
      "decision": "DENY",
      "notes": "Observer role does not have isolate_xapp privileges.",
      "rationale": "The observer role is attempting an action (isolate_xapp) not permitted by the policy.",
      "review_id": "review-b81f5780440c5d0e6a3d26e4d925ce70",
      "rule_refs": [
        "roles.observer"
      ]
    },
    {
      "ambiguity": false,
      "decision": "DENY",
      "notes": "Observer role does not have rate_limit_ue privileges.",
      "rationale": "The observer role is attempting an action (rate_limit_ue) not permitted by the policy.",
      "review_id": "review-4b7b93a2405684e7d3d264aee9e048d7",
      "rule_refs": [
        "roles.observer"
      ]
    },
    {
      "ambiguity": false,
      "decision": "ESCALATE",
      "notes": "High risk action requires approval, but approval is missing.",
      "rationale": "Action has high risk and is in approval_required_actions but lacks an approval block.",
      "review_id": "review-04669f8d68865df44b0c2917fe278cb3",
      "rule_refs": [
        "approval_required_actions",
        "approval_required_for_risk"
      ]
    },
    {
      "ambiguity": false,
      "decision": "ALLOW",
      "notes": "Valid approved modify_a1_policy action.",
      "rationale": "Valid role, target, parameters, and valid trusted approval.",
      "review_id": "review-47fb4672dafe9df390952462e0b1d752",
      "rule_refs": []
    },
    {
      "ambiguity": false,
      "decision": "ESCALATE",
      "notes": "Conflict with an active action on the same target.",
      "rationale": "An active action exists with the same interface, target type, target ID, and control parameter.",
      "review_id": "review-cf6ac76ae39e2ba83f47dc4b64596891",
      "rule_refs": []
    },
    {
      "ambiguity": false,
      "decision": "ESCALATE",
      "notes": "Approval required for isolate_xapp.",
      "rationale": "Action is in approval_required_actions and risk is high, but approval is missing.",
      "review_id": "review-65dad135918a124663442cf5b558faf8",
      "rule_refs": [
        "approval_required_actions"
      ]
    },
    {
      "ambiguity": false,
      "decision": "ALLOW",
      "notes": "Valid quarantine_ue by security_responder.",
      "rationale": "Medium risk, parameters in bounds, non-protected slice, no approval required.",
      "review_id": "review-45846dd1051a68ac7386f20392fb9547",
      "rule_refs": []
    },
    {
      "ambiguity": false,
      "decision": "ESCALATE",
      "notes": "Active action conflict on the UE target.",
      "rationale": "An active action exists for the same target with the same control parameter.",
      "review_id": "review-9bcdf4b18de389be8c64fc8cb1eb0775",
      "rule_refs": []
    },
    {
      "ambiguity": false,
      "decision": "ESCALATE",
      "notes": "Active action conflict on xApp target.",
      "rationale": "An active action exists for the same target with the same control parameter.",
      "review_id": "review-c44b55979be6f5a641d09c8b9538f2de",
      "rule_refs": []
    },
    {
      "ambiguity": false,
      "decision": "ALLOW",
      "notes": "Valid rate limit action.",
      "rationale": "Authorized responder targeting a non-protected slice, parameters within bounds.",
      "review_id": "review-cbe72177f21d74691706ea398c3f9564",
      "rule_refs": []
    },
    {
      "ambiguity": false,
      "decision": "DENY",
      "notes": "Duration exceeds maximum.",
      "rationale": "Parameter duration_seconds is 1200, which exceeds the maximum value of 600.",
      "review_id": "review-0b8fca916e3edb7bec91a10788a02862",
      "rule_refs": [
        "parameter_bounds.isolate_xapp.duration_seconds"
      ]
    },
    {
      "ambiguity": false,
      "decision": "ESCALATE",
      "notes": "High risk action without approval.",
      "rationale": "Action risk is high, which requires approval, but none is provided.",
      "review_id": "review-e03f87671b7a6a7f216df1b44d4b249c",
      "rule_refs": [
        "approval_required_for_risk"
      ]
    },
    {
      "ambiguity": false,
      "decision": "ALLOW",
      "notes": "Valid and approved modify_a1_policy.",
      "rationale": "Matches all required constraints and approval hash is correct.",
      "review_id": "review-81518e4c0d5e096a2b7ee4154dbaaf05",
      "rule_refs": []
    },
    {
      "ambiguity": false,
      "decision": "ESCALATE",
      "notes": "Missing approval for isolate_xapp.",
      "rationale": "isolate_xapp requires approval, but none was supplied.",
      "review_id": "review-bb2016661b40ecd70a0f97b2e87f4ed3",
      "rule_refs": [
        "approval_required_actions"
      ]
    },
    {
      "ambiguity": false,
      "decision": "DENY",
      "notes": "Disruptive action on a protected slice.",
      "rationale": "Action modifies A1 policy on slice-emergency, which is protected.",
      "review_id": "review-720aa954cb2be87e7e2628b22da7828b",
      "rule_refs": [
        "protected_slices"
      ]
    },
    {
      "ambiguity": false,
      "decision": "DENY",
      "notes": "Disruptive action on a protected slice.",
      "rationale": "Action quarantines UE on slice-emergency, which is protected.",
      "review_id": "review-a50b305a92c169b11bd926416ca29725",
      "rule_refs": [
        "protected_slices"
      ]
    },
    {
      "ambiguity": false,
      "decision": "ALLOW",
      "notes": "Valid rate_limit_ue by security_responder.",
      "rationale": "Medium risk on an unprotected slice within parameter bounds.",
      "review_id": "review-addf5d4d0e43eef1f595b499460c8e91",
      "rule_refs": []
    },
    {
      "ambiguity": false,
      "decision": "DENY",
      "notes": "Duration exceeds maximum.",
      "rationale": "Parameter duration_seconds is 1200, exceeding the allowed maximum of 600.",
      "review_id": "review-92e0ad13ed686c98b85a5ee30c02d1be",
      "rule_refs": [
        "parameter_bounds.isolate_xapp.duration_seconds"
      ]
    },
    {
      "ambiguity": false,
      "decision": "DENY",
      "notes": "Disruptive action on protected slice.",
      "rationale": "Target slice slice-emergency is in protected_slices.",
      "review_id": "review-53c501aafe154714027a53cf629dd050",
      "rule_refs": [
        "protected_slices"
      ]
    },
    {
      "ambiguity": false,
      "decision": "DENY",
      "notes": "Disruptive action on protected slice.",
      "rationale": "Target slice slice-emergency is in protected_slices.",
      "review_id": "review-7e762740d69f7f32b82cb2d91a626bbd",
      "rule_refs": [
        "protected_slices"
      ]
    },
    {
      "ambiguity": false,
      "decision": "ESCALATE",
      "notes": "Missing approval for modify_a1_policy.",
      "rationale": "Action is in approval_required_actions but has no approval block.",
      "review_id": "review-12f08d36435cc30619ac85e028b42c71",
      "rule_refs": [
        "approval_required_actions"
      ]
    },
    {
      "ambiguity": false,
      "decision": "ESCALATE",
      "notes": "Missing approval for isolate_xapp.",
      "rationale": "Action requires approval but has no approval block.",
      "review_id": "review-b01c5db6414a3c4af00becf55d89f437",
      "rule_refs": [
        "approval_required_actions"
      ]
    },
    {
      "ambiguity": false,
      "decision": "DENY",
      "notes": "Duration exceeds parameter bounds for quarantine_ue.",
      "rationale": "duration_seconds is 600, exceeding the maximum 300.",
      "review_id": "review-5d7b250c01fb46c2f8846054d779aa74",
      "rule_refs": [
        "parameter_bounds.quarantine_ue.duration_seconds"
      ]
    },
    {
      "ambiguity": false,
      "decision": "DENY",
      "notes": "Observer lacks privileges for rate_limit_ue.",
      "rationale": "Action is not found in the roles mapping for observer.",
      "review_id": "review-555f0b58ebd76cbfe98c159dfa54cb97",
      "rule_refs": [
        "roles.observer"
      ]
    },
    {
      "ambiguity": false,
      "decision": "DENY",
      "notes": "Policy weight exceeds bounds.",
      "rationale": "policy_weight is 1.5, exceeding the maximum of 1.0.",
      "review_id": "review-6f2c5ab6aa209c916600f0fad0ec84b6",
      "rule_refs": [
        "parameter_bounds.modify_a1_policy.policy_weight"
      ]
    },
    {
      "ambiguity": false,
      "decision": "ESCALATE",
      "notes": "High risk action requires approval.",
      "rationale": "The proposal has high risk but lacks an approval block.",
      "review_id": "review-af4c5c18a405373be9c0848716e0a617",
      "rule_refs": [
        "approval_required_for_risk"
      ]
    },
    {
      "ambiguity": false,
      "decision": "ESCALATE",